{
  "project_id": "test",
  "started_at": "2026-06-05T02:33:16.254610+00:00",
  "completed_at": "2026-06-05T02:33:16.494804+00:00",
  "exit_code": 0,
  "steps": [
    {
      "seq": 1,
      "action": "can_execute",
      "prolog_call": "can_execute(test, solve(white_shrimp, adult)).",
      "result": "allow",
      "timestamp": "2026-06-05T02:33:16.319268+00:00"
    },
    {
      "seq": 2,
      "action": "solve_formulation",
      "prolog_call": "solve_formulation(white_shrimp, adult).",
      "result": "solved",
      "timestamp": "2026-06-05T02:33:16.381048+00:00"
    },
    {
      "seq": 3,
      "action": "delivery_gatekeeper",
      "prolog_call": "deliverable(white_shrimp, adult, D), write(D)",
      "result": "passed",
      "timestamp": "2026-06-05T02:33:16.494438+00:00"
    }
  ]
}